article_id,original_article,best_edited_article,best_iteration
What is the worst that could happen with Trump being president?,"The Trump Steamroller Is Broken - The Atlantic Skip to content Site Navigation The Atlantic Popular Latest Newsletters Sections Politics Ideas Fiction Technology Science Photo Economy Culture Planet Global Books AI Watchdog Health Education Projects Features Family Events Washington Week Progress National Security Explore The Atlantic Archive Play The Atlantic Games Listen to Podcasts and Articles The Print Edition Latest Issue Past Issues Give a Gift Search The Atlantic Quick Links Audio Crossword Puzzle Magazine Archive Your Subscription Popular Latest Newsletters Sign In Subscribe Politics The Trump Steamroller Is Broken Infighting. Bad polls. Party divisions. Midterm fears. It’s all back. By Jonathan Lemire Illustration by The Atlantic. Source: Kevin Dietsch / Getty November 19, 2025 Share Save Listen − 1.0 x + 0:00 11:11 Listen to more stories on the Noa app. P resident Donald Trump’s administration has been embroiled in scandal and sloppiness. His own party has defied his political pressure. His senior staff has been beset by infighting. He has sparred with reporters and offered over-the-top praise to an authoritarian with a dire human-rights record. A signature hard-line immigration policy has polled poorly. And Republicans have begun to brace themselves for a disastrous midterm election. That was 2017. But it’s also 2025. Ten months into the president’s second term, Trump 2.0 is for the first time starting to resemble the chaotic original. And that new sense of political weakness in the president has not just emboldened Democrats who have been despondent for much of the past year. It’s also begun to give Republicans a permission structure for pushing back against Trump and jockeying for power with an eye to the elections ahead. This was not the plan. Trump and his inner circle used their four years out of office to create a policy blueprint—drawn substantially from Project 2025—and form a disciplined team of true believers who used their experience with the levers of power to dominate their political opposition. The beginning of Trump’s second term was marked by an unprecedented display of executive authority, as the president dominated a subservient Congress and defied the courts, brought to heel some of the nation’s most formidable institutions and wealthiest people, fulfilled long-held conservative wishes to dramatically shrink the size and influence of the federal government, reoriented the nation’s relationship with the rest of the world, and rammed through legislation that benefited the rich over the working class and the poor. Trump has been a steamroller. But that has begun to change. Voters punished Trump’s party in this month’s elections, seeming to condemn his presidential overreach and the abandonment of his central campaign promise to rehabilitate the nation’s economy. A rare Republican rebellion on Capitol Hill rattled the West Wing and embarrassed the president. And although the White House likes to project a political image of never surrendering, a pair of retreats in the past few days has punctured Trump’s aura of invincibility. F ew things have frustrated Trump like his inability to make Jeffrey Epstein go away. The disgraced sex offender and financier, of course, has been dead for six years. But questions about the powerful men with whom he associated—and the mystery around his death in prison, which was ruled a suicide—created a conspiracy theory in the MAGA base that has overwhelmed the White House. Trump angrily ordered his supporters to let the matter go this past summer but was largely ignored. And then, last week, four GOP lawmakers—some of whom have been among Trump’s most ardent acolytes—triggered a full House vote to release Department of Justice records related to Epstein. Read: Epstein returns at the worst time for Trump Revolt was in the air. One of those defiant lawmakers, the MAGA icon Representative Marjorie Taylor Greene, did not buckle, even as Trump called her a traitor. “Let me tell you what a traitor is,” she responded yesterday. “A traitor is an American that serves foreign countries and themselves.” GOP leadership signaled to the White House that most lawmakers could not put their name to a vote to protect a pedophile and that the measure would pass easily, two officials told me on the condition of anonymity to discuss private conversations. Trump was furious, but he didn’t want to be seen as getting rolled by his own party. Trying to save face, he begrudgingly posted on social media that he would support Republicans who voted to release the files. The measure passed the House yesterday 427–1. It then cleared the Senate by unanimous consent. Trump announced tonight he had signed it. (Questions persist as to whether the Justice Department may try to block the release of some or all of the files, citing a need to protect an ongoing investigation of prominent Democrats that it launched last week at Trump’s request.) The other Trump walk-back came far less dramatically, buried in the text of an executive order released late Friday. But it was no less noteworthy. Trump, as is often said, has few constant ideological stances, yet one is that tariffs will spur economic growth and benefit the consumer. In a tacit admission that tariffs have, in fact, caused prices to rise (as most economists have long said), the administration quietly lifted tariffs on goods such as bananas, beef, and coffee. The reversal came days after Republicans were swept in off-year elections in places such as Virginia, New Jersey, and New York City . Voters made clear that the GOP was not fulfilling its promises on affordability that helped Trump get elected last year. A number of Republican lawmakers loudly insisted that Trump needs to refocus on prices and inflation—defiance reminiscent of when senators voted down the White House–led efforts to repeal the Affordable Care Act in 2017. C haos within the White House was the norm during Trump’s first term. This time around, the president’s team has prioritized professionalism and tried to minimize turnover. Senior-level firings have been rare, and even the president’s deposed national security adviser, Mike Waltz, was given a soft-landing spot as ambassador to the United Nations. Trump’s first administration was plagued by sloppiness; the original travel ban, Trump veterans will remember with a shudder, was hastily scrawled by Stephen Miller and Steve Bannon and not properly reviewed by government attorneys before it was enacted. (It was promptly tossed out by a federal court.) This time, Trump aides vowed they would be methodical and efficient, and for months, they faced little resistance as they rolled out the president’s agenda. But that sense of disorder has returned, and the losses have begun to pile up. Just in the past two weeks: Trump’s prized tariffs were greeted with great skepticism by the Supreme Court, with the justices appearing unsympathetic to the notion that the president could usurp what is normally congressional power on the back of a flimsy declaration of a national emergency. The president’s campaign of retribution may have hit a snag when a federal judge found that the case put forth by Trump’s handpicked interim U.S. attorney, Lindsey Halligan, was marred by a series of errors that could lead to the dismissal of the criminal case against former FBI Director James Comey. And yesterday, a Trump-appointed federal judge issued a rebuke of the methodology used by Republicans in Texas to redistrict the state’s congressional map. (The judge wrote in his opinion that it was “challenging to unpack” all of the “factual, legal, and typographical errors” in a Justice Department letter that claimed that the original districts were to be eliminated because they were created solely on the basis of race.) Trump, desperate for his party to keep control of both houses of Congress next fall, had pushed for a number of GOP-led states to create more Republican seats, but he took a loss in Texas and has been rebuffed by Indiana, meaning that the Democrats—who responded to the Texas push by successfully creating friendly districts in California and may follow suit in Virginia and Maryland—could end up besting the Republicans at their own game. The administration is confident that the Supreme Court will take up the Texas case and ultimately approve the new districts. Read: ‘None of this is good for Republicans’ There have been other recent flashbacks to Trump’s first term. Much like in 2018, the president and the Republicans were on the losing end of a government shutdown. Infighting was frequent during the first Trump administration, as aides tried to knife one another in the press to improve their standing with the boss. There has been less internal dysfunction this time around—especially after Elon Musk departed DOGE —but last week, Health and Human Services Secretary Robert F. Kennedy Jr. had to publicly ask his supporters to stop criticizing White House Chief of Staff Susie Wiles for allegedly blocking his MAHA agenda. And yesterday, the president ignored the CIA’s conclusion that Saudi Crown Prince Mohammed bin Salman played a role in the murder of the Washington Post columnist Jamal Khashoggi—much as in Helsinki in 2018, when Trump famously sided with Vladimir Putin over U.S. intelligence agencies on Russian election interference. When an ABC News reporter asked about Khashoggi in front of MBS, Trump threatened to revoke the network’s broadcast license. The White House spokesperson Kush Desai told me in a statement that the past two weeks have brought nothing but victories. “President Trump and the Administration have been delivering results since Day One, and the past two weeks have objectively been a continuation of this winning streak for the American people,” he said. But White House aides have privately admitted that this month has been the most challenging stretch of Trump’s second term. Other Republicans have begun to notice. Some of Trump’s closest allies have warned him about polls that show the public is unhappy with some of his extreme moves, including cheering on masked ICE raids and demolishing the East Wing of the White House. Trump has so far been unwilling to do much to take on—or even acknowledge—the problem of affordability, but aides say that plans will be unveiled soon. Meanwhile, an urgency has set in: The calendar churns even for a president who has wielded power in extraordinary ways. Each day closer to next year’s midterms is a reminder that Trump is a lame duck whose time governing with Republicans in charge at either end of Pennsylvania Avenue could soon be coming to a close. Even before then, his sway within his own party appears to be ebbing. One official who worked in both Trump administrations told me, “The president has had absolute loyalty from Republicans this year.” But, the official added, “losing that would be the first step toward losing power—and relevancy.” About the Author Jonathan Lemire Follow Jonathan Lemire is a staff writer at The Atlantic . Explore More Topics Donald Trump , Republican Party , Texas , White House Popular Links About Our History Careers Contact Help Center Contact Us Atlantic Brand Partners Press Reprints & Permissions Podcasts Radio Atlantic Good on Paper The David Frum Show How to Age Up Autocracy in America Subscription Purchase Give a Gift Manage Subscription Group Subscriptions Atlantic Editions Newsletters Follow facebook instagram youtube twitter linkedin flipboard About Our History Careers Contact Help Center Contact Us Atlantic Brand Partners Press Reprints & Permissions Podcasts Radio Atlantic Good on Paper The David Frum Show How to Age Up Autocracy in America Subscription Purchase Give a Gift Manage Subscription Group Subscriptions Atlantic Editions Newsletters Follow facebook instagram youtube twitter linkedin flipboard Site Information Privacy Policy Your Privacy Choices privacy-options Advertising Guidelines Terms & Conditions Terms of Sale Responsible Disclosure Site Map TheAtlantic.com © 2025 The Atlantic Monthly Group. All Rights Reserved. This site is protected by reCAPTCHA and the Google Privacy Policy and Terms of Service apply","The Trump Steamroller Is Broken - The Atlantic Skip to content Site Navigation The Atlantic Popular Latest Newsletters Sections Politics Ideas Fiction Technology Science Photo Economy Culture Planet Global Books AI Watchdog Health Education Projects Features Family Events Washington Week Progress National Security Explore The Atlantic Archive Play The Atlantic Games Listen to Podcasts and Articles The Print Edition Latest Issue Past Issues Give a Gift Search The Atlantic Quick Links Audio Crossword Puzzle Magazine Archive Your Subscription Popular Latest Newsletters Sign In Subscribe Politics The Trump Steamroller Is Broken Infighting. Bad polls. Party divisions. Midterm fears. It’s all back. By Jonathan Lemire Illustration by The Atlantic. Source: Kevin Dietsch / Getty November 19, 2025 Share Save Listen − 1.0 x + 0:00 11:11 Listen to more stories on the Noa app. P resident Donald Trump’s administration has been embroiled in scandal and sloppiness. His own party has defied his political pressure. His senior staff has been beset by infighting. He has sparred with reporters and offered over-the-top praise to an authoritarian with a dire human-rights record. A signature hard-line immigration policy has polled poorly. And Republicans have begun to brace themselves for a disastrous midterm election. That was 2017. But it’s also 2025. Ten months into the president’s second term, Trump 2.0 is for the first time starting to resemble the chaotic original. And that new sense of political weakness in the president has not just emboldened Democrats who have been despondent for much of the past year. It’s also begun to give Republicans a permission structure for pushing back against Trump and jockeying for power with an eye to the elections ahead. This was not the plan. Trump and his inner circle used their four years out of office to create a policy blueprint—drawn substantially from Project 2025
, an initiative designed to prepare conservative loyalists to dismantle the administrative state and implement a sweeping 'America First' agenda, including aggressive trade deals, deregulation, and a significant restructuring of federal agencies,
—and form a disciplined team of true believers who used their experience with the levers of power to dominate their political opposition.
This included appointing loyalists to critical positions such as National Security Advisor (initially Mike Waltz), Health and Human Services Secretary (Robert F. Kennedy Jr.), and White House Chief of Staff (Susie Wiles), all intended to ensure a methodical and efficient execution of the president's agenda.
 The beginning of Trump’s second term was marked by an unprecedented display of executive authority, as the president dominated a subservient Congress and defied the courts, brought to heel some of the nation’s most formidable institutions and wealthiest people, fulfilled long-held conservative wishes to dramatically shrink the size and influence of the federal government, reoriented the nation’s relationship with the rest of the world, and rammed through legislation that benefited the rich over the working class and the poor. Trump has been a steamroller. But that has begun to change. Voters punished Trump’s party in this month’s elections, seeming to condemn his presidential overreach and the abandonment of his central campaign promise to rehabilitate the nation’s economy. A rare Republican rebellion on Capitol Hill rattled the West Wing and embarrassed the president. And although the White House likes to project a political image of never surrendering, a pair of retreats in the past few days has punctured Trump’s aura of invincibility. F ew things have frustrated Trump like his inability to make Jeffrey Epstein go away. The disgraced sex offender and financier, of course, has been dead for six years. But questions about the powerful men with whom he associated—and the mystery around his death in prison, which was ruled a suicide—created a conspiracy theory in the MAGA base that has overwhelmed the White House. Trump angrily ordered his supporters to let the matter go this past summer but was largely ignored. And then, last week, four GOP lawmakers—some of whom have been among Trump’s most ardent acolytes—triggered a full House vote to release Department of Justice records related to Epstein. Read: Epstein returns at the worst time for Trump Revolt was in the air. One of those defiant lawmakers, the MAGA icon Representative Marjorie Taylor Greene, did not buckle, even as Trump called her a traitor. “Let me tell you what a traitor is,” she responded yesterday. “A traitor is an American that serves foreign countries and themselves.” GOP leadership signaled to the White House that most lawmakers could not put their name to a vote to protect a pedophile and that the measure would pass easily, two officials told me on the condition of anonymity to discuss private conversations. Trump was furious, but he didn’t want to be seen as getting rolled by his own party. Trying to save face, he begrudgingly posted on social media that he would support Republicans who voted to release the files. The measure passed the House yesterday 427–1. It then cleared the Senate by unanimous consent. Trump announced tonight he had signed it. (Questions persist as to whether the Justice Department may try to block the release of some or all of the files, citing a need to protect an ongoing investigation of prominent Democrats that it launched last week at Trump’s request.) The other Trump walk-back came far less dramatically, buried in the text of an executive order released late Friday. But it was no less noteworthy. Trump, as is often said, has few constant ideological stances, yet one is that tariffs will spur economic growth and benefit the consumer. In a tacit admission that tariffs have, in fact, caused prices to rise (as most economists have long said), the administration quietly lifted tariffs on goods such as bananas, beef, and coffee. The reversal came days after Republicans were swept in off-year elections in places such as Virginia, New Jersey, and New York City . Voters made clear that the GOP was not fulfilling its promises on affordability that helped Trump get elected last year. A number of Republican lawmakers loudly insisted that Trump needs to refocus on prices and inflation—defiance reminiscent of when senators voted down the White House–led efforts to repeal the Affordable Care Act in 2017. C haos within the White House was the norm during Trump’s first term. This time around, the president’s team has prioritized professionalism and tried to minimize turnover. Senior-level firings have been rare, and even the president’s deposed national security adviser, Mike Waltz, was given a soft-landing spot as ambassador to the United Nations. Trump’s first administration was plagued by sloppiness; the original travel ban, Trump veterans will remember with a shudder, was hastily scrawled by Stephen Miller and Steve Bannon and not properly reviewed by government attorneys before it was enacted. (It was promptly tossed out by a federal court.) This time, Trump aides vowed they would be methodical and efficient, and for months, they faced little resistance as they rolled out the president’s agenda. But that sense of disorder has returned, and the losses have begun to pile up. Just in the past two weeks: Trump’s prized tariffs were greeted with great skepticism by the Supreme Court, with the justices appearing unsympathetic to the notion that the president could usurp what is normally congressional power on the back of a flimsy declaration of a national emergency. The president’s campaign of retribution may have hit a snag when a federal judge found that the case put forth by Trump’s handpicked interim U.S. attorney, Lindsey Halligan, was marred by a series of errors that could lead to the dismissal of the criminal case against former FBI Director James Comey. And yesterday, a Trump-appointed federal judge issued a rebuke of the methodology used by Republicans in Texas to redistrict the state’s congressional map. (The judge wrote in his opinion that it was “challenging to unpack” all of the “factual, legal, and typographical errors” in a Justice Department letter that claimed that the original districts were to be eliminated because they were created solely on the basis of race.) Trump, desperate for his party to keep control of both houses of Congress next fall, had pushed for a number of GOP-led states to create more Republican seats, but he took a loss in Texas and has been rebuffed by Indiana, meaning that the Democrats—who responded to the Texas push by successfully creating friendly districts in California and may follow suit in Virginia and Maryland—could end up besting the Republicans at their own game. The administration is confident that the Supreme Court will take up the Texas case and ultimately approve the new districts. Read: ‘None of this is good for Republicans’ There have been other recent flashbacks to Trump’s first term. Much like in 2018, the president and the Republicans were on the losing end of a government shutdown. Infighting was frequent during the first Trump administration, as aides tried to knife one another in the press to improve their standing with the boss. There has been less internal dysfunction this time around—especially after Elon Musk departed DOGE —but last week, Health and Human Services Secretary Robert F. Kennedy Jr. had to publicly ask his supporters to stop criticizing White House Chief of Staff Susie Wiles for allegedly blocking his MAHA agenda. And yesterday, the president ignored the CIA’s conclusion that Saudi Crown Prince Mohammed bin Salman played a role in the murder of the Washington Post columnist Jamal Khashoggi—much as in Helsinki in 2018, when Trump famously sided with Vladimir Putin over U.S. intelligence agencies on Russian election interference. When an ABC News reporter asked about Khashoggi in front of MBS, Trump threatened to revoke the network’s broadcast license. The White House spokesperson Kush Desai told me in a statement that the past two weeks have brought nothing but victories. “President Trump and the Administration have been delivering results since Day One, and the past two weeks have objectively been a continuation of this winning streak for the American people,” he said. But White House aides have privately admitted that this month has been the most challenging stretch of Trump’s second term. Other Republicans have begun to notice. Some of Trump’s closest allies have warned him about polls that show the public is unhappy with some of his extreme moves, including cheering on masked ICE raids and demolishing the East Wing of the White House. Trump has so far been unwilling to do much to take on—or even acknowledge—the problem of affordability, but aides say that plans will be unveiled soon. Meanwhile, an urgency has set in: The calendar churns even for a president who has wielded power in extraordinary ways. Each day closer to next year’s midterms is a reminder that Trump is a lame duck whose time governing with Republicans in charge at either end of Pennsylvania Avenue could soon be coming to a close. Even before then, his sway within his own party appears to be ebbing. One official who worked in both Trump administrations told me, “The president has had absolute loyalty from Republicans this year.” But, the official added, “losing that would be the first step toward losing power—and relevancy.” About the Author Jonathan Lemire Follow Jonathan Lemire is a staff writer at The Atlantic . Explore More Topics Donald Trump , Republican Party , Texas , White House Popular Links About Our History Careers Contact Help Center Contact Us Atlantic Brand Partners Press Reprints & Permissions Podcasts Radio Atlantic Good on Paper The David Frum Show How to Age Up Autocracy in America Subscription Purchase Give a Gift Manage Subscription Group Subscriptions Atlantic Editions Newsletters Follow facebook instagram youtube twitter linkedin flipboard About Our History Careers Contact Help Center Contact Us Atlantic Brand Partners Press Reprints & Permissions Podcasts Radio Atlantic Good on Paper The David Frum Show How to Age Up Autocracy in America Subscription Purchase Give a Gift Manage Subscription Group Subscriptions Atlantic Editions Newsletters Follow facebook instagram youtube twitter linkedin flipboard Site Information Privacy Policy Your Privacy Choices privacy-options Advertising Guidelines Terms & Conditions Terms of Sale Responsible Disclosure Site Map TheAtlantic.com © 2025 The Atlantic Monthly Group. All Rights Reserved. This site is protected by reCAPTCHA and the Google Privacy Policy and Terms of Service apply

which further outlined aggressive trade deals, comprehensive tax cuts, enhanced border security, and a focus on 'American Energy Dominance.' It also detailed plans for military ethos restoration, re-evaluation of international alliances, and significant executive action to reverse prior policies and streamline federal agencies, including the establishment of a Department of Government Efficiency (DOGE).
",3
